Activities,State,Category ,Park,Area Name,,,,,,,,,,,,,,,,,,,,,,,,,,,,,,,,,,,,,,,,,,,,,,,,,,,,,,,,,,,,,,,,,,,,,,,,,,,,,,,,,,,,,,,,,,,,,,,,,,,,,,,,,,,,,,,,,,,,,,,,,,,,,,Category,Park,Area Name,State,Category,Park,Area Name,State,Category,Park,Area Name,State,Category,Park,Area Name,,,,,,,,,,,,,,,,,,,,,,,,,,,,,,,,,,,,,,,,,,,,,,,,,,,,,,,,,,,,,,,,,,,,,,,,,,,,,,,,,,,,,,,,,,,Park,Area Name,State,Category,Park,Area Name,State,,,,,,,,,,,,,,,,,,,,,,,,,,,,,,,,,,,,,,,,,,,,,,,,,,,,,,,,,,,,,,,,,,,,,,,,,,,,,,,,,,,,,,,,State,Category,Park,Area Name,State,Category,Park,Area Name,State,Category,Park,Area Name,State,Category,Park,Area Name
 Camping, ME, National Park, Acadia National Park, Acadia,,,,,,,,,,,,,,,,,,,,,,,,,,,,,,,,,,,,,,,,,,,,,,,,,,,,,,,,,,,,,,,,,,,,,,,,,,,,,,,,,,,,,,,,,,,,,,,,,,,,,,,,,,,,,,,,,,,,,,,,,,,,,, National Monument, Castle Mountains National Monument, Castle Mountains," FL, ", National Seashore, Canaveral National Seashore, Canaveral," UT, ", National Park, Canyonlands National Park, Canyonlands," UT, ", National Park, Capitol Reef National Park, Capitol Reef,,,,,,,,,,,,,,,,,,,,,,,,,,,,,,,,,,,,,,,,,,,,,,,,,,,,,,,,,,,,,,,,,,,,,,,,,,,,,,,,,,,,,,,,,,, Dinosaur National Monument, Dinosaur," FL, ", National Park, Dry Tortugas National Park, Dry Tortugas," WA, ",,,,,,,,,,,,,,,,,,,,,,,,,,,,,,,,,,,,,,,,,,,,,,,,,,,,,,,,,,,,,,,,,,,,,,,,,,,,,,,,,,,,,,,," FL,MS, ", National Seashore, Gulf Islands National Seashore, Gulf Islands," TX, ", National Park, Guadalupe Mountains National Park, Guadalupe Mountains," HI, ", National Park, Haleakalā National Park, Haleakalā," HI, ", National Park, Hawaiʻi Volcanoes National Park, Hawaiʻi Volcanoes
, AK , Wild River, Alagnak Wild River, Alagnak,,,,,,,,,,,,,,,,,,,,,,,,,,,,,,,,,,,,,,,,,,,,,,,,,,,,,,,,,,,,,,,,,,,,,,,,,,,,,,,,,,,,,,,,,,,,,,,,,,,,,,,,,,,,,,,,,,,,,,,,,,,,,, National Seashore, Canaveral National Seashore, Canaveral," UT, ", National Park, Canyonlands National Park, Canyonlands," UT, ", National Park, Capitol Reef National Park, Capitol Reef," MD, ", Park, Catoctin Mountain Park, Catoctin Mountain,,,,,,,,,,,,,,,,,,,,,,,,,,,,,,,,,,,,,,,,,,,,,,,,,,,,,,,,,,,,,,,,,,,,,,,,,,,,,,,,,,,,,,,,,,, Dry Tortugas National Park, Dry Tortugas," WA, ", National Historical Reserve," ""Ebeys Landing National Historical Reserve"""," ""Ebeys Landing"""," NM, ",,,,,,,,,,,,,,,,,,,,,,,,,,,,,,,,,,,,,,,,,,,,,,,,,,,,,,,,,,,,,,,,,,,,,,,,,,,,,,,,,,,,,,,," TX, ", National Park, Guadalupe Mountains National Park, Guadalupe Mountains," HI, ", National Park, Haleakalā National Park, Haleakalā," HI, ", National Park, Hawaiʻi Volcanoes National Park, Hawaiʻi Volcanoes,,,,
, TX  , National Monument, Alibates Flint Quarries National Monument, Alibates Flint Quarries,,,,,,,,,,,,,,,,,,,,,,,,,,,,,,,,,,,,,,,,,,,,,,,,,,,,,,,,,,,,,,,,,,,,,,,,,,,,,,,,,,,,,,,,,,,,,,,,,,,,,,,,,,,,,,,,,,,,,,,,,,,,,, National Park, Canyonlands National Park, Canyonlands," UT, ", National Park, Capitol Reef National Park, Capitol Reef," MD, ", Park, Catoctin Mountain Park, Catoctin Mountain," NM, ", National Park, Carlsbad Caverns National Park, Carlsbad Caverns,,,,,,,,,,,,,,,,,,,,,,,,,,,,,,,,,,,,,,,,,,,,,,,,,,,,,,,,,,,,,,,,,,,,,,,,,,,,,,,,,,,,,,,,,,," ""Ebeys Landing National Historical Reserve"""," ""Ebeys Landing"""," NM, ", National Monument, El Malpais National Monument, El Malpais," NM, ",,,,,,,,,,,,,,,,,,,,,,,,,,,,,,,,,,,,,,,,,,,,,,,,,,,,,,,,,,,,,,,,,,,,,,,,,,,,,,,,,,,,,,,," HI, ", National Park, Haleakalā National Park, Haleakalā," HI, ", National Park, Hawaiʻi Volcanoes National Park, Hawaiʻi Volcanoes,,,,,,,,
, HI  , National Historic Trail, Ala Kahakai National Historic Trail, Ala Kahakai,,,,,,,,,,,,,,,,,,,,,,,,,,,,,,,,,,,,,,,,,,,,,,,,,,,,,,,,,,,,,,,,,,,,,,,,,,,,,,,,,,,,,,,,,,,,,,,,,,,,,,,,,,,,,,,,,,,,,,,,,,,,,, National Park, Capitol Reef National Park, Capitol Reef," MD, ", Park, Catoctin Mountain Park, Catoctin Mountain," NM, ", National Park, Carlsbad Caverns National Park, Carlsbad Caverns," UT, ", National Monument, Cedar Breaks National Monument, Cedar Breaks,,,,,,,,,,,,,,,,,,,,,,,,,,,,,,,,,,,,,,,,,,,,,,,,,,,,,,,,,,,,,,,,,,,,,,,,,,,,,,,,,,,,,,,,,,, El Malpais National Monument, El Malpais," NM, ", National Monument, El Morro National Monument, El Morro," FL, ",,,,,,,,,,,,,,,,,,,,,,,,,,,,,,,,,,,,,,,,,,,,,,,,,,,,,,,,,,,,,,,,,,,,,,,,,,,,,,,,,,,,,,,," HI, ", National Park, Hawaiʻi Volcanoes National Park, Hawaiʻi Volcanoes,,,,,,,,,,,,
, TX  , National Recreation Area, Amistad National Recreation Area, Amistad,,,,,,,,,,,,,,,,,,,,,,,,,,,,,,,,,,,,,,,,,,,,,,,,,,,,,,,,,,,,,,,,,,,,,,,,,,,,,,,,,,,,,,,,,,,,,,,,,,,,,,,,,,,,,,,,,,,,,,,,,,,,,, Park, Catoctin Mountain Park, Catoctin Mountain," NM, ", National Park, Carlsbad Caverns National Park, Carlsbad Caverns," UT, ", National Monument, Cedar Breaks National Monument, Cedar Breaks," NM, ", National Historical Park, Chaco Culture National Historical Park, Chaco Culture,,,,,,,,,,,,,,,,,,,,,,,,,,,,,,,,,,,,,,,,,,,,,,,,,,,,,,,,,,,,,,,,,,,,,,,,,,,,,,,,,,,,,,,,,,, El Morro National Monument, El Morro," FL, ", National Park, Everglades National Park, Everglades," NY, ",,,,,,,,,,,,,,,,,,,,,,,,,,,,,,,,,,,,,,,,,,,,,,,,,,,,,,,,,,,,,,,,,,,,,,,,,,,,,,,,,,,,,,,,,,,,,,,,,,,,,,,
, GA  , National Historic Site, Andersonville National Historic Site, Andersonville,,,,,,,,,,,,,,,,,,,,,,,,,,,,,,,,,,,,,,,,,,,,,,,,,,,,,,,,,,,,,,,,,,,,,,,,,,,,,,,,,,,,,,,,,,,,,,,,,,,,,,,,,,,,,,,,,,,,,,,,,,,,,, National Park, Carlsbad Caverns National Park, Carlsbad Caverns," UT, ", National Monument, Cedar Breaks National Monument, Cedar Breaks," NM, ", National Historical Park, Chaco Culture National Historical Park, Chaco Culture," OK, ", National Recreation Area, Chickasaw National Recreation Area, Chickasaw,,,,,,,,,,,,,,,,,,,,,,,,,,,,,,,,,,,,,,,,,,,,,,,,,,,,,,,,,,,,,,,,,,,,,,,,,,,,,,,,,,,,,,,,,,, Everglades National Park, Everglades," NY, ", National Seashore, Fire Island National Seashore, Fire Island," AK, ",,,,,,,,,,,,,,,,,,,,,,,,,,,,,,,,,,,,,,,,,,,,,,,,,,,,,,,,,,,,,,,,,,,,,,,,,,,,,,,,,,,,,,,,,,,,,,,,,,,,,,,
, AK  , National Monument & Preserve, Aniakchak National Monument & Preserve, Aniakchak,,,,,,,,,,,,,,,,,,,,,,,,,,,,,,,,,,,,,,,,,,,,,,,,,,,,,,,,,,,,,,,,,,,,,,,,,,,,,,,,,,,,,,,,,,,,,,,,,,,,,,,,,,,,,,,,,,,,,,,,,,,,,, National Monument, Cedar Breaks National Monument, Cedar Breaks," NM, ", National Historical Park, Chaco Culture National Historical Park, Chaco Culture," OK, ", National Recreation Area, Chickasaw National Recreation Area, Chickasaw," AZ, ", National Monument, Chiricahua National Monument, Chiricahua,,,,,,,,,,,,,,,,,,,,,,,,,,,,,,,,,,,,,,,,,,,,,,,,,,,,,,,,,,,,,,,,,,,,,,,,,,,,,,,,,,,,,,,,,,, Fire Island National Seashore, Fire Island," AK, ", National Park & Preserve, Gates Of The Arctic National Park & Preserve, Gates Of The Arctic," WV, ",,,,,,,,,,,,,,,,,,,,,,,,,,,,,,,,,,,,,,,,,,,,,,,,,,,,,,,,,,,,,,,,,,,,,,,,,,,,,,,,,,,,,,,,,,,,,,,,,,,,,,,
, MD  , National Battlefield, Antietam National Battlefield, Antietam,,,,,,,,,,,,,,,,,,,,,,,,,,,,,,,,,,,,,,,,,,,,,,,,,,,,,,,,,,,,,,,,,,,,,,,,,,,,,,,,,,,,,,,,,,,,,,,,,,,,,,,,,,,,,,,,,,,,,,,,,,,,,, National Historical Park, Chaco Culture National Historical Park, Chaco Culture," OK, ", National Recreation Area, Chickasaw National Recreation Area, Chickasaw," AZ, ", National Monument, Chiricahua National Monument, Chiricahua," CA, ", National Park, Channel Islands National Park, Channel Islands,,,,,,,,,,,,,,,,,,,,,,,,,,,,,,,,,,,,,,,,,,,,,,,,,,,,,,,,,,,,,,,,,,,,,,,,,,,,,,,,,,,,,,,,,,, Gates Of The Arctic National Park & Preserve, Gates Of The Arctic," WV, ", National Recreation Area, Gauley River National Recreation Area, Gauley River," NY,NJ, ",,,,,,,,,,,,,,,,,,,,,,,,,,,,,,,,,,,,,,,,,,,,,,,,,,,,,,,,,,,,,,,,,,,,,,,,,,,,,,,,,,,,,,,,,,,,,,,,,,,,,,,
, WI  , National Lakeshore, Apostle Islands National Lakeshore, Apostle Islands,,,,,,,,,,,,,,,,,,,,,,,,,,,,,,,,,,,,,,,,,,,,,,,,,,,,,,,,,,,,,,,,,,,,,,,,,,,,,,,,,,,,,,,,,,,,,,,,,,,,,,,,,,,,,,,,,,,,,,,,,,,,,, National Recreation Area, Chickasaw National Recreation Area, Chickasaw," AZ, ", National Monument, Chiricahua National Monument, Chiricahua," CA, ", National Park, Channel Islands National Park, Channel Islands," DC,MD,WV, ", National Historical Park, Chesapeake & Ohio Canal National Historical Park, Chesapeake & Ohio Canal,,,,,,,,,,,,,,,,,,,,,,,,,,,,,,,,,,,,,,,,,,,,,,,,,,,,,,,,,,,,,,,,,,,,,,,,,,,,,,,,,,,,,,,,,,, Gauley River National Recreation Area, Gauley River," NY,NJ, ", National Recreation Area, Gateway National Recreation Area, Gateway," PA, ",,,,,,,,,,,,,,,,,,,,,,,,,,,,,,,,,,,,,,,,,,,,,,,,,,,,,,,,,,,,,,,,,,,,,,,,,,,,,,,,,,,,,,,,,,,,,,,,,,,,,,,
," CT, GA, MA, MD, ME, NC, NH, NJ, NY, PA, TN, VA, VT, WV  ", National Scenic Trail, Appalachian National Scenic Trail, Appalachian,,,,,,,,,,,,,,,,,,,,,,,,,,,,,,,,,,,,,,,,,,,,,,,,,,,,,,,,,,,,,,,,,,,,,,,,,,,,,,,,,,,,,,,,,,,,,,,,,,,,,,,,,,,,,,,,,,,,,,,,,,,,,, National Monument, Chiricahua National Monument, Chiricahua," CA, ", National Park, Channel Islands National Park, Channel Islands," DC,MD,WV, ", National Historical Park, Chesapeake & Ohio Canal National Historical Park, Chesapeake & Ohio Canal," ID, ", National Reserve, City Of Rocks National Reserve, City Of Rocks,,,,,,,,,,,,,,,,,,,,,,,,,,,,,,,,,,,,,,,,,,,,,,,,,,,,,,,,,,,,,,,,,,,,,,,,,,,,,,,,,,,,,,,,,,, Gateway National Recreation Area, Gateway," PA, ", National Military Park, Gettysburg National Military Park, Gettysburg," NM, ",,,,,,,,,,,,,,,,,,,,,,,,,,,,,,,,,,,,,,,,,,,,,,,,,,,,,,,,,,,,,,,,,,,,,,,,,,,,,,,,,,,,,,,,,,,,,,,,,,,,,,,
, UT  , National Park, Arches National Park, Arches,,,,,,,,,,,,,,,,,,,,,,,,,,,,,,,,,,,,,,,,,,,,,,,,,,,,,,,,,,,,,,,,,,,,,,,,,,,,,,,,,,,,,,,,,,,,,,,,,,,,,,,,,,,,,,,,,,,,,,,,,,,,,, National Park, Channel Islands National Park, Channel Islands," DC,MD,WV, ", National Historical Park, Chesapeake & Ohio Canal National Historical Park, Chesapeake & Ohio Canal," ID, ", National Reserve, City Of Rocks National Reserve, City Of Rocks," CO, ", National Monument, Colorado National Monument, Colorado,,,,,,,,,,,,,,,,,,,,,,,,,,,,,,,,,,,,,,,,,,,,,,,,,,,,,,,,,,,,,,,,,,,,,,,,,,,,,,,,,,,,,,,,,,, Gettysburg National Military Park, Gettysburg," NM, ", National Monument, Gila Cliff Dwellings National Monument, Gila Cliff Dwellings," MT, ",,,,,,,,,,,,,,,,,,,,,,,,,,,,,,,,,,,,,,,,,,,,,,,,,,,,,,,,,,,,,,,,,,,,,,,,,,,,,,,,,,,,,,,,,,,,,,,,,,,,,,,
," MD, VA  ", National Seashore, Assateague Island National Seashore, Assateague Island,,,,,,,,,,,,,,,,,,,,,,,,,,,,,,,,,,,,,,,,,,,,,,,,,,,,,,,,,,,,,,,,,,,,,,,,,,,,,,,,,,,,,,,,,,,,,,,,,,,,,,,,,,,,,,,,,,,,,,,,,,,,,, National Historical Park, Chesapeake & Ohio Canal National Historical Park, Chesapeake & Ohio Canal," ID, ", National Reserve, City Of Rocks National Reserve, City Of Rocks," CO, ", National Monument, Colorado National Monument, Colorado," SC, ", National Park,Congaree National Park, Congaree,,,,,,,,,,,,,,,,,,,,,,,,,,,,,,,,,,,,,,,,,,,,,,,,,,,,,,,,,,,,,,,,,,,,,,,,,,,,,,,,,,,,,,,,,,, Gila Cliff Dwellings National Monument, Gila Cliff Dwellings," MT, ", National Park, Glacier National Park, Glacier," AK, ",,,,,,,,,,,,,,,,,,,,,,,,,,,,,,,,,,,,,,,,,,,,,,,,,,,,,,,,,,,,,,,,,,,,,,,,,,,,,,,,,,,,,,,,,,,,,,,,,,,,,,,
, SD  , National Park, Badlands National Park, Badlands,,,,,,,,,,,,,,,,,,,,,,,,,,,,,,,,,,,,,,,,,,,,,,,,,,,,,,,,,,,,,,,,,,,,,,,,,,,,,,,,,,,,,,,,,,,,,,,,,,,,,,,,,,,,,,,,,,,,,,,,,,,,,, National Reserve, City Of Rocks National Reserve, City Of Rocks," CO, ", National Monument, Colorado National Monument, Colorado," SC, ", National Park,Congaree National Park, Congaree," OR, ", National Park,Crater Lake National Park, Crater Lake,,,,,,,,,,,,,,,,,,,,,,,,,,,,,,,,,,,,,,,,,,,,,,,,,,,,,,,,,,,,,,,,,,,,,,,,,,,,,,,,,,,,,,,,,,, Glacier National Park, Glacier," AK, ", National Park & Preserve, Glacier Bay National Park & Preserve, Glacier Bay," AZ,UT, ",,,,,,,,,,,,,,,,,,,,,,,,,,,,,,,,,,,,,,,,,,,,,,,,,,,,,,,,,,,,,,,,,,,,,,,,,,,,,,,,,,,,,,,,,,,,,,,,,,,,,,,
, NM  , National Monument, Bandelier National Monument, Bandelier,,,,,,,,,,,,,,,,,,,,,,,,,,,,,,,,,,,,,,,,,,,,,,,,,,,,,,,,,,,,,,,,,,,,,,,,,,,,,,,,,,,,,,,,,,,,,,,,,,,,,,,,,,,,,,,,,,,,,,,,,,,,,, National Monument, Colorado National Monument, Colorado," SC, ", National Park,Congaree National Park, Congaree," OR, ", National Park,Crater Lake National Park, Crater Lake," ID, ", National Monument & Preserve, Craters Of The Moon National Monument & Preserve, Craters Of The Moon,,,,,,,,,,,,,,,,,,,,,,,,,,,,,,,,,,,,,,,,,,,,,,,,,,,,,,,,,,,,,,,,,,,,,,,,,,,,,,,,,,,,,,,,,,, Glacier Bay National Park & Preserve, Glacier Bay," AZ,UT, "," glca, designation", National Recreation Area, Glen Canyon National Recreation Area," CA, ",,,,,,,,,,,,,,,,,,,,,,,,,,,,,,,,,,,,,,,,,,,,,,,,,,,,,,,,,,,,,,,,,,,,,,,,,,,,,,,,,,,,,,,,,,,,,,,,,,,,,,,
, AK  , National Preserve, Bering Land Bridge National Preserve, Bering Land Bridge,,,,,,,,,,,,,,,,,,,,,,,,,,,,,,,,,,,,,,,,,,,,,,,,,,,,,,,,,,,,,,,,,,,,,,,,,,,,,,,,,,,,,,,,,,,,,,,,,,,,,,,,,,,,,,,,,,,,,,,,,,,,,, National Park,Congaree National Park, Congaree," OR, ", National Park,Crater Lake National Park, Crater Lake," ID, ", National Monument & Preserve, Craters Of The Moon National Monument & Preserve, Craters Of The Moon," KY,TN,VA, ", National Historical Park, Cumberland Gap National Historical Park, Cumberland Gap,,,,,,,,,,,,,,,,,,,,,,,,,,,,,,,,,,,,,,,,,,,,,,,,,,,,,,,,,,,,,,,,,,,,,,,,,,,,,,,,,,,,,,,,,,, National Recreation Area, Glen Canyon National Recreation Area," CA, ", National Recreation Area, Golden Gate National Recreation Area, Golden Gate," NV, ",,,,,,,,,,,,,,,,,,,,,,,,,,,,,,,,,,,,,,,,,,,,,,,,,,,,,,,,,,,,,,,,,,,,,,,,,,,,,,,,,,,,,,,,,,,,,,,,,,,,,,,
, TX  , National Park, Big Bend National Park, Big Bend,,,,,,,,,,,,,,,,,,,,,,,,,,,,,,,,,,,,,,,,,,,,,,,,,,,,,,,,,,,,,,,,,,,,,,,,,,,,,,,,,,,,,,,,,,,,,,,,,,,,,,,,,,,,,,,,,,,,,,,,,,,,,, National Park,Crater Lake National Park, Crater Lake," ID, ", National Monument & Preserve, Craters Of The Moon National Monument & Preserve, Craters Of The Moon," KY,TN,VA, ", National Historical Park, Cumberland Gap National Historical Park, Cumberland Gap," GA, ", National Seashore, Cumberland Island National Seashore, Cumberland Island,,,,,,,,,,,,,,,,,,,,,,,,,,,,,,,,,,,,,,,,,,,,,,,,,,,,,,,,,,,,,,,,,,,,,,,,,,,,,,,,,,,,,,,,,,, Golden Gate National Recreation Area, Golden Gate," NV, ", National Park, Great Basin National Park, Great Basin," AZ, ",,,,,,,,,,,,,,,,,,,,,,,,,,,,,,,,,,,,,,,,,,,,,,,,,,,,,,,,,,,,,,,,,,,,,,,,,,,,,,,,,,,,,,,,,,,,,,,,,,,,,,,
," MT, WY  ", National Recreation Area, Bighorn Canyon National Recreation Area, Bighorn Canyon,,,,,,,,,,,,,,,,,,,,,,,,,,,,,,,,,,,,,,,,,,,,,,,,,,,,,,,,,,,,,,,,,,,,,,,,,,,,,,,,,,,,,,,,,,,,,,,,,,,,,,,,,,,,,,,,,,,,,,,,,,,,,, National Monument & Preserve, Craters Of The Moon National Monument & Preserve, Craters Of The Moon," KY,TN,VA, ", National Historical Park, Cumberland Gap National Historical Park, Cumberland Gap," GA, ", National Seashore, Cumberland Island National Seashore, Cumberland Island," CO, ", National Recreation Area, Curecanti National Recreation Area, Curecanti,,,,,,,,,,,,,,,,,,,,,,,,,,,,,,,,,,,,,,,,,,,,,,,,,,,,,,,,,,,,,,,,,,,,,,,,,,,,,,,,,,,,,,,,,,, Great Basin National Park, Great Basin," AZ, ", National Park, Grand Canyon National Park, Grand Canyon," MD, ",,,,,,,,,,,,,,,,,,,,,,,,,,,,,,,,,,,,,,,,,,,,,,,,,,,,,,,,,,,,,,,,,,,,,,,,,,,,,,,,,,,,,,,,,,,,,,,,,,,,,,,
, FL  , National Preserve, Big Cypress National Preserve, Big Cypress,,,,,,,,,,,,,,,,,,,,,,,,,,,,,,,,,,,,,,,,,,,,,,,,,,,,,,,,,,,,,,,,,,,,,,,,,,,,,,,,,,,,,,,,,,,,,,,,,,,,,,,,,,,,,,,,,,,,,,,,,,,,,, National Historical Park, Cumberland Gap National Historical Park, Cumberland Gap," GA, ", National Seashore, Cumberland Island National Seashore, Cumberland Island," CO, ", National Recreation Area, Curecanti National Recreation Area, Curecanti," OH, ", National Park, Cuyahoga Valley National Park, Cuyahoga Valley,,,,,,,,,,,,,,,,,,,,,,,,,,,,,,,,,,,,,,,,,,,,,,,,,,,,,,,,,,,,,,,,,,,,,,,,,,,,,,,,,,,,,,,,,,, Grand Canyon National Park, Grand Canyon," MD, ", Park, Greenbelt Park, Greenbelt," NJ, ",,,,,,,,,,,,,,,,,,,,,,,,,,,,,,,,,,,,,,,,,,,,,,,,,,,,,,,,,,,,,,,,,,,,,,,,,,,,,,,,,,,,,,,,,,,,,,,,,,,,,,,
, FL  , National Park, Biscayne National Park, Biscayne,,,,,,,,,,,,,,,,,,,,,,,,,,,,,,,,,,,,,,,,,,,,,,,,,,,,,,,,,,,,,,,,,,,,,,,,,,,,,,,,,,,,,,,,,,,,,,,,,,,,,,,,,,,,,,,,,,,,,,,,,,,,,, National Seashore, Cumberland Island National Seashore, Cumberland Island," CO, ", National Recreation Area, Curecanti National Recreation Area, Curecanti," OH, ", National Park, Cuyahoga Valley National Park, Cuyahoga Valley," AK, ", National Park & Preserve, Denali National Park & Preserve, Denali,,,,,,,,,,,,,,,,,,,,,,,,,,,,,,,,,,,,,,,,,,,,,,,,,,,,,,,,,,,,,,,,,,,,,,,,,,,,,,,,,,,,,,,,,,, Greenbelt Park, Greenbelt," NJ, ", , Great Egg Harbor River, Great Egg Harbor River," MN, ",,,,,,,,,,,,,,,,,,,,,,,,,,,,,,,,,,,,,,,,,,,,,,,,,,,,,,,,,,,,,,,,,,,,,,,,,,,,,,,,,,,,,,,,,,,,,,,,,,,,,,,
," KY, TN  ", National River & Recreation Area, Big South Fork National River & Recreation Area, Big South Fork,,,,,,,,,,,,,,,,,,,,,,,,,,,,,,,,,,,,,,,,,,,,,,,,,,,,,,,,,,,,,,,,,,,,,,,,,,,,,,,,,,,,,,,,,,,,,,,,,,,,,,,,,,,,,,,,,,,,,,,,,,,,,, National Recreation Area, Curecanti National Recreation Area, Curecanti," OH, ", National Park, Cuyahoga Valley National Park, Cuyahoga Valley," AK, ", National Park & Preserve, Denali National Park & Preserve, Denali," CA, ", National Monument, Devils Postpile National Monument, Devils Postpile,,,,,,,,,,,,,,,,,,,,,,,,,,,,,,,,,,,,,,,,,,,,,,,,,,,,,,,,,,,,,,,,,,,,,,,,,,,,,,,,,,,,,,,,,,, Great Egg Harbor River, Great Egg Harbor River," MN, ", National Monument, Grand Portage National Monument, Grand Portage," CO, ",,,,,,,,,,,,,,,,,,,,,,,,,,,,,,,,,,,,,,,,,,,,,,,,,,,,,,,,,,,,,,,,,,,,,,,,,,,,,,,,,,,,,,,,,,,,,,,,,,,,,,,
, TX  , National Preserve, Big Thicket National Preserve, Big Thicket,,,,,,,,,,,,,,,,,,,,,,,,,,,,,,,,,,,,,,,,,,,,,,,,,,,,,,,,,,,,,,,,,,,,,,,,,,,,,,,,,,,,,,,,,,,,,,,,,,,,,,,,,,,,,,,,,,,,,,,,,,,,,, National Park, Cuyahoga Valley National Park, Cuyahoga Valley," AK, ", National Park & Preserve, Denali National Park & Preserve, Denali," CA, ", National Monument, Devils Postpile National Monument, Devils Postpile," WY, ", National Monument, Devils Tower National Monument, Devils Tower,,,,,,,,,,,,,,,,,,,,,,,,,,,,,,,,,,,,,,,,,,,,,,,,,,,,,,,,,,,,,,,,,,,,,,,,,,,,,,,,,,,,,,,,,,, Grand Portage National Monument, Grand Portage," CO, ", National Park & Preserve, Great Sand Dunes National Park & Preserve, Great Sand Dunes," NC,TN, ",,,,,,,,,,,,,,,,,,,,,,,,,,,,,,,,,,,,,,,,,,,,,,,,,,,,,,,,,,,,,,,,,,,,,,,,,,,,,,,,,,,,,,,,,,,,,,,,,,,,,,,
, CO  , National Park, Black Canyon Of The Gunnison National Park, Black Canyon Of The Gunnison,,,,,,,,,,,,,,,,,,,,,,,,,,,,,,,,,,,,,,,,,,,,,,,,,,,,,,,,,,,,,,,,,,,,,,,,,,,,,,,,,,,,,,,,,,,,,,,,,,,,,,,,,,,,,,,,,,,,,,,,,,,,,, National Park & Preserve, Denali National Park & Preserve, Denali," CA, ", National Monument, Devils Postpile National Monument, Devils Postpile," WY, ", National Monument, Devils Tower National Monument, Devils Tower," CA,NV, ", National Park, Death Valley National Park, Death Valley,,,,,,,,,,,,,,,,,,,,,,,,,,,,,,,,,,,,,,,,,,,,,,,,,,,,,,,,,,,,,,,,,,,,,,,,,,,,,,,,,,,,,,,,,,, Great Sand Dunes National Park & Preserve, Great Sand Dunes," NC,TN, ", National Park, Great Smoky Mountains National Park, Great Smoky Mountains," WY, ",,,,,,,,,,,,,,,,,,,,,,,,,,,,,,,,,,,,,,,,,,,,,,,,,,,,,,,,,,,,,,,,,,,,,,,,,,,,,,,,,,,,,,,,,,,,,,,,,,,,,,,
," NC, VA  ", Parkway, Blue Ridge Parkway, Blue Ridge,,,,,,,,,,,,,,,,,,,,,,,,,,,,,,,,,,,,,,,,,,,,,,,,,,,,,,,,,,,,,,,,,,,,,,,,,,,,,,,,,,,,,,,,,,,,,,,,,,,,,,,,,,,,,,,,,,,,,,,,,,,,,, National Monument, Devils Postpile National Monument, Devils Postpile," WY, ", National Monument, Devils Tower National Monument, Devils Tower," CA,NV, ", National Park, Death Valley National Park, Death Valley," NJ,PA, ", National Recreation Area, Delaware Water Gap National Recreation Area, Delaware Water Gap,,,,,,,,,,,,,,,,,,,,,,,,,,,,,,,,,,,,,,,,,,,,,,,,,,,,,,,,,,,,,,,,,,,,,,,,,,,,,,,,,,,,,,,,,,, Great Smoky Mountains National Park, Great Smoky Mountains," WY, ", National Park, Grand Teton National Park, Grand Teton," FL,MS, ",,,,,,,,,,,,,,,,,,,,,,,,,,,,,,,,,,,,,,,,,,,,,,,,,,,,,,,,,,,,,,,,,,,,,,,,,,,,,,,,,,,,,,,,,,,,,,,,,,,,,,,
," RI, MA  ", National Historical Park, Blackstone River Valley National Historical Park, Blackstone River Valley,,,,,,,,,,,,,,,,,,,,,,,,,,,,,,,,,,,,,,,,,,,,,,,,,,,,,,,,,,,,,,,,,,,,,,,,,,,,,,,,,,,,,,,,,,,,,,,,,,,,,,,,,,,,,,,,,,,,,,,,,,,,,, National Monument, Devils Tower National Monument, Devils Tower," CA,NV, ", National Park, Death Valley National Park, Death Valley," NJ,PA, ", National Recreation Area, Delaware Water Gap National Recreation Area, Delaware Water Gap," CO,UT, ", National Monument, Dinosaur National Monument, Dinosaur,,,,,,,,,,,,,,,,,,,,,,,,,,,,,,,,,,,,,,,,,,,,,,,,,,,,,,,,,,,,,,,,,,,,,,,,,,,,,,,,,,,,,,,,,,, Grand Teton National Park, Grand Teton," FL,MS, ", National Seashore, Gulf Islands National Seashore, Gulf Islands," TX, ",,,,,,,,,,,,,,,,,,,,,,,,,,,,,,,,,,,,,,,,,,,,,,,,,,,,,,,,,,,,,,,,,,,,,,,,,,,,,,,,,,,,,,,,,,,,,,,,,,,,,,,
, MA  , National Recreation Area, Boston Harbor Islands National Recreation Area, Boston Harbor Islands,,,,,,,,,,,,,,,,,,,,,,,,,,,,,,,,,,,,,,,,,,,,,,,,,,,,,,,,,,,,,,,,,,,,,,,,,,,,,,,,,,,,,,,,,,,,,,,,,,,,,,,,,,,,,,,,,,,,,,,,,,,,,, National Park, Death Valley National Park, Death Valley," NJ,PA, ", National Recreation Area, Delaware Water Gap National Recreation Area, Delaware Water Gap," CO,UT, ", National Monument, Dinosaur National Monument, Dinosaur," FL, ", National Park, Dry Tortugas National Park, Dry Tortugas,,,,,,,,,,,,,,,,,,,,,,,,,,,,,,,,,,,,,,,,,,,,,,,,,,,,,,,,,,,,,,,,,,,,,,,,,,,,,,,,,,,,,,,,,,, Gulf Islands National Seashore, Gulf Islands," TX, ", National Park, Guadalupe Mountains National Park, Guadalupe Mountains," HI, ",,,,,,,,,,,,,,,,,,,,,,,,,,,,,,,,,,,,,,,,,,,,,,,,,,,,,,,,,,,,,,,,,,,,,,,,,,,,,,,,,,,,,,,,,,,,,,,,,,,,,,,
, UT  , National Park, Bryce Canyon National Park, Bryce Canyon,,,,,,,,,,,,,,,,,,,,,,,,,,,,,,,,,,,,,,,,,,,,,,,,,,,,,,,,,,,,,,,,,,,,,,,,,,,,,,,,,,,,,,,,,,,,,,,,,,,,,,,,,,,,,,,,,,,,,,,,,,,,,, National Recreation Area, Delaware Water Gap National Recreation Area, Delaware Water Gap," CO,UT, ", National Monument, Dinosaur National Monument, Dinosaur," FL, ", National Park, Dry Tortugas National Park, Dry Tortugas," WA, ", National Historical Reserve," ""Ebeys Landing National Historical Reserve"""," ""Ebeys Landing""",,,,,,,,,,,,,,,,,,,,,,,,,,,,,,,,,,,,,,,,,,,,,,,,,,,,,,,,,,,,,,,,,,,,,,,,,,,,,,,,,,,,,,,,,,, Guadalupe Mountains National Park, Guadalupe Mountains," HI, ", National Park, Haleakalā National Park, Haleakalā," HI, ",,,,,,,,,,,,,,,,,,,,,,,,,,,,,,,,,,,,,,,,,,,,,,,,,,,,,,,,,,,,,,,,,,,,,,,,,,,,,,,,,,,,,,,,,,,,,,,,,,,,,,,
, AR  , National River, Buffalo National River, Buffalo,,,,,,,,,,,,,,,,,,,,,,,,,,,,,,,,,,,,,,,,,,,,,,,,,,,,,,,,,,,,,,,,,,,,,,,,,,,,,,,,,,,,,,,,,,,,,,,,,,,,,,,,,,,,,,,,,,,,,,,,,,,,,, National Monument, Dinosaur National Monument, Dinosaur," FL, ", National Park, Dry Tortugas National Park, Dry Tortugas," WA, ", National Historical Reserve," ""Ebeys Landing National Historical Reserve"""," ""Ebeys Landing"""," NM, ", National Monument, El Malpais National Monument, El Malpais,,,,,,,,,,,,,,,,,,,,,,,,,,,,,,,,,,,,,,,,,,,,,,,,,,,,,,,,,,,,,,,,,,,,,,,,,,,,,,,,,,,,,,,,,,, Haleakalā National Park, Haleakalā," HI, ", National Park, Hawaiʻi Volcanoes National Park, Hawaiʻi Volcanoes,,,,,,,,,,,,,,,,,,,,,,,,,,,,,,,,,,,,,,,,,,,,,,,,,,,,,,,,,,,,,,,,,,,,,,,,,,,,,,,,,,,,,,,,,,,,,,,,,,,,,,,,
, AZ  , National Monument, Canyon de Chelly National Monument, Canyon de Chelly,,,,,,,,,,,,,,,,,,,,,,,,,,,,,,,,,,,,,,,,,,,,,,,,,,,,,,,,,,,,,,,,,,,,,,,,,,,,,,,,,,,,,,,,,,,,,,,,,,,,,,,,,,,,,,,,,,,,,,,,,,,,,, National Park, Dry Tortugas National Park, Dry Tortugas," WA, ", National Historical Reserve," ""Ebeys Landing National Historical Reserve"""," ""Ebeys Landing"""," NM, ", National Monument, El Malpais National Monument, El Malpais," NM, ", National Monument, El Morro National Monument, El Morro,,,,,,,,,,,,,,,,,,,,,,,,,,,,,,,,,,,,,,,,,,,,,,,,,,,,,,,,,,,,,,,,,,,,,,,,,,,,,,,,,,,,,,,,,,, Hawaiʻi Volcanoes National Park, Hawaiʻi Volcanoes,,,,,,,,,,,,,,,,,,,,,,,,,,,,,,,,,,,,,,,,,,,,,,,,,,,,,,,,,,,,,,,,,,,,,,,,,,,,,,,,,,,,,,,,,,,,,,,,,,,,,,,,,,,,
, MA  , National Seashore, Cape Cod National Seashore, Cape Cod,,,,,,,,,,,,,,,,,,,,,,,,,,,,,,,,,,,,,,,,,,,,,,,,,,,,,,,,,,,,,,,,,,,,,,,,,,,,,,,,,,,,,,,,,,,,,,,,,,,,,,,,,,,,,,,,,,,,,,,,,,,,,, National Historical Reserve," ""Ebeys Landing National Historical Reserve"""," ""Ebeys Landing"""," NM, ", National Monument, El Malpais National Monument, El Malpais," NM, ", National Monument, El Morro National Monument, El Morro," FL, ", National Park, Everglades National Park, Everglades,,,,,,,,,,,,,,,,,,,,,,,,,,,,,,,,,,,,,,,,,,,,,,,,,,,,,,,,,,,,,,,,,,,,,,,,,,,,,,,,,,,,,,,,,,,,,,,,,,,,,,,,,,,,,,,,,,,,,,,,,,,,,,,,,,,,,,,,,,,,,,,,,,,,,,,,,,,,,,,,,,,,,,,,,,,,,,,,,,,,,,,,,,,,,,,,,,,,,,,,
, NC  , National Seashore, Cape Hatteras National Seashore, Cape Hatteras,,,,,,,,,,,,,,,,,,,,,,,,,,,,,,,,,,,,,,,,,,,,,,,,,,,,,,,,,,,,,,,,,,,,,,,,,,,,,,,,,,,,,,,,,,,,,,,,,,,,,,,,,,,,,,,,,,,,,,,,,,,,,, National Monument, El Malpais National Monument, El Malpais," NM, ", National Monument, El Morro National Monument, El Morro," FL, ", National Park, Everglades National Park, Everglades," NY, ", National Seashore, Fire Island National Seashore, Fire Island,,,,,,,,,,,,,,,,,,,,,,,,,,,,,,,,,,,,,,,,,,,,,,,,,,,,,,,,,,,,,,,,,,,,,,,,,,,,,,,,,,,,,,,,,,,,,,,,,,,,,,,,,,,,,,,,,,,,,,,,,,,,,,,,,,,,,,,,,,,,,,,,,,,,,,,,,,,,,,,,,,,,,,,,,,,,,,,,,,,,,,,,,,,,,,,,,,,,,,,,
